ano,nome_musica,artista,letra
1976,"Nem Ouro, Nem Prata",Ruy Maurity,"Eu vi chover, eu vi relampear
Mas mesmo assim o céu estava azul
Samborê pemba, folha de jurema
Oxóssi reina de norte a sul
Eu vi chover, eu vi relampear
Mas mesmo assim o céu estava azul
Samborê pemba, folha de jurema
Oxóssi reina de norte a sul
Sou brasileira faceira
Mestiça, mulata
Não tem ouro, nem prata
O samba que sangra do meu coração
Tua menina de cor
Pedaço de bom carinho
Entrei no teu passo, malandra
Eu não sou como a tal Conceição
Chega de tanto exaltar essa tal de saudade
Meu caboclo moreno, mulato
Amuleto do nosso Brasil
Olha, meu preto bonito
Te quero, prometo, te gosto
Pra sempre do samba-canção
Ao primeiro apito do ano 2000
Olha, meu preto bonito
Te quero, prometo, te gosto
Pra sempre do samba-canção
Ao primeiro apito do ano 2000
Eu vi chover, eu vi relampear
Mas mesmo assim o céu estava azul
Samborê pemba, folha de jurema
Oxóssi reina de norte a sul
Eu vi chover, eu vi relampear
Mas mesmo assim o céu estava azul
Samborê pemba, folha de jurema
Oxóssi reina de norte a sul
Sou brasileira faceira
Mestiça, mulata
Não tem ouro, nem prata
O samba que sangra do meu coração
Tua menina de cor
Pedaço de bom carinho
Entrei no teu passo, malandra
Eu não sou como a tal Conceição
Chega de tanto exaltar essa tal de saudade
Meu caboclo moreno, mulato
Amuleto do nosso Brasil
Olha, meu preto bonito
Te quero, prometo, te gosto
Pra sempre do samba-canção
Ao primeiro apito do ano 2000
Olha, meu preto bonito
Te quero, prometo, te gosto
Pra sempre do samba-canção
Ao primeiro apito do ano 2000"
1980,"Bola de Meia, Bola de Gude",Milton Nascimento,"Há um menino, há um moleque
Morando sempre no meu coração
Toda vez que o adulto balança
Ele vem pra me dar a mão
Há um passado no meu presente
Um Sol bem quente lá no meu quintal
Toda vez que a bruxa me assombra
O menino me dá a mão
E me fala de coisas bonitas
Que eu acredito que não deixarão de existir
Amizade, palavra, respeito
Caráter, bondade, alegria e amor
Pois não posso, não devo, não quero
Viver como toda essa gente insiste em viver
E não posso aceitar sossegado
Qualquer sacanagem ser coisa normal
Bola de meia, bola de gude
O solidário não quer solidão
Toda vez que a tristeza me alcança
O menino me dá a mão
Há um menino, há um moleque
Morando sempre no meu coração
Toda vez que o adulto fraqueja
Ele vem pra me dar a mão"
1993,Have I Told You Lately,Rod Stewart,"Have I told you lately that I love you?
Have I told you there's no one else above you?
You fill my heart with gladness, take away all my sadness
Ease my troubles, that's what you do
For the mornin' Sun and all its glory
Greets the day with hope and comfort, too
You fill my life with laughter, somehow you make it better
Ease my troubles, that's what you do
There's a love that's divine, and it's yours and it's mine
Like the Sun
And at the end of the day, we should give thanks and pray
To the one, to the one
Have I told you lately that I love you?
Have I told you there's no one else above you?
You fill my heart with gladness, take away all my sadness
Ease my troubles, that's what you do
There's a love that's divine, and it's yours and it's mine
Like the Sun
And at the end of the day, we should give thanks and pray
To the one, to the one
And have I told you lately that I love you?
Have I told you there's no one else above you?
You fill my heart with gladness, take away all my sadness
Ease my troubles, that's what you do
Take away all my sadness, you fill my heart with gladness
Ease my troubles, that's what you do
Take away all my sadness, you fill my heart with gladness
Ease my troubles, that's what you do"
1970,Little Woman,McFly,"She was a quiet little woman
But no one really gave her a chance
But she kept a little secret
She really had a passion to dance
She was out on the town
When the DJ started playing the blues
Well there was no stopping her now
She's put on her dancing shoes
She was twisting baby
Come on
Don't wanna miss this lady
Come on
Gotta get a glance
Gotta watch her dance
Come on"
2004,Samba Makossa,Charlie Brown Jr.,"Minha família, quer tudo como quem não quer nada
Mas toma uma de assalto quando chega na parada
Samba maioral
Onde é que você se meteu
Antes de chegar na roda, meu irmão?
Eu disse samba maioral
Onde é que você se meteu
Antes de chegar na roda, sangue bom?
A responsabilidade de tocar o seu pandeiro
É a responsabilidade de você manter-se inteiro
É de você manter-se inteiro, inteiro
Por isso chegou a hora
Dessa roda começar
Samba Makossa da pesada
Vamos todos celebrar
Cerebral
É assim que tem que ser
Maioral
Porque é assim que é
Mão da cabeça e o skate no pé
Samba Makossa tem hora marcada
É da quebrada, é da quebrada
Samba maioral
Onde é que você se meteu
Antes de chegar na roda, sangue bom?
A responsabilidade de tocar o seu pandeiro
É a responsabilidade de você manter-se inteiro
É, é de você manter-se inteiro
Por isso chegou a hora
Dessa roda começar
Samba Makossa da pesada
Vamos todos celebrar
Cerebral
É assim que tem que ser
Maioral
Porque é assim que é
Mão da cabeça e skate no pé
Samba Makossa tem hora marcada
É da pesada, é da pesada
É da pesada, é da pesada
No sapatinho
Modernizar o passado
É uma revolução musical
Cadê as notas que estavam aqui?
Não preciso delas
Basta que soe bem aos ouvidos
Viva Zapata! Viva Sandino! Viva Zumbi!
Antônio Conselheiro (Sabotage)
Todos os Panteras Negras
Lampião, sua imagem semelhança
Eu tenho certeza, assim como Sabotage
Chico Science, eles também cantaram um dia
Samba, samba, samba, samba, samba
Samba, samba, samba, samba, samba, samba, samba
Samba, samba, samba, samba, samba
Samba, samba, sambou
Eu disse samba, samba, samba, samba, samba
Samba, samba, samba, samba, samba
Samba, samba
Maioral
É assim que tem que ser
Maioral
Porque é assim que é
Mão na cabeça e skate no pé
Samba Makossa tem hora marcada
É da pesada
É da quebrada, é da quebrada"
1971,Ovo de Codorna,Luiz Gonzaga,"Eu quero um ovo de codorna pra comer
O meu problema ele tem que resolver
Eu quero um ovo de codorna pra comer
O meu problema ele tem que resolver
Eu tô madurão passei da flor da idade
Mas ainda tenho alguma mocidade
Vou cuidar de mim pra não acontecer
Vou comprar ovo de codorna pra comer
Eu quero um ovo de codorna pra comer
O meu problema ele tem que resolver
Eu quero um ovo de codorna pra comer
O meu problema ele tem que resolver
Eu já procurei um doutor meu amigo
Ele me falou pode contar comigo
Ele me ensinou e eu passo pra você
Vou lhe dar ovo de codorna pra comer
Eu quero um ovo de codorna pra comer
O meu problema ele tem que resolver
Eu quero um ovo de codorna pra comer
O meu problema ele tem que resolver
Eu andava triste quase apavorado
Estavam me fazendo de um pobre coitado
Minha companheira tá feliz porque, hum
Eu comprei ovo de codorna pra comer
Eu quero um ovo de codorna pra comer
O meu problema ele tem que resolver
Eu quero um ovo de codorna pra comer
O meu problema ele tem que resolver
Eu tô madurão passei da flor da idade
Mas ainda tenho alguma mocidade
Vou cuidar de mim pra não acontecer
Vou comprar ovo de codorna pra comer
Eu quero um ovo de codorna pra comer
O meu problema ele tem que resolver
Eu quero um ovo de codorna pra comer
O meu problema ele tem que resolver"
1978,Bandeira do Divino,Ivan Lins,"Os devotos do Divino
Vão abrir sua morada
Pra bandeira do Menino
Ser bem-vinda, ser louvada, ai, ai
Os devotos do divino
Vão abrir sua morada
Pra bandeira do Menino
Ser bem-vinda, ser louvada, ai, ai
Deus vos salve esse devoto
Pela esmola em vosso nome
Dando água a quem tem sede
Dando pão a quem tem fome, ai, ai
Deus vos salve esse devoto
Pela esmola em vosso nome
Dando água a quem tem sede
Dando pão a quem tem fome, ai, ai
A bandeira acredita
Que a semente seja tanta
Que essa mesa seja farta
Que essa casa seja santa, ai, ai
A bandeira acredita
Que a semente seja tanta
Que essa mesa seja farta
Que essa casa seja santa, ai, ai
Que o perdão seja sagrado
Que a fé seja infinita
Que o homem seja livre
Que a justiça sobreviva, ai, ai
Que o perdão seja sagrado
Que a fé seja infinita
Que o homem seja livre
Que a justiça sobreviva, ai, ai
Assim como os três reis magos
Que seguiram a estrela-guia
A bandeira segue em frente
Atrás de melhores dias, ai, ai
Assim como os três reis magos
Que seguiram a estrela-guia
A bandeira segue em frente
Atrás de melhores dias, ai, ai
No estandarte vai escrito
Que Ele voltará de novo
E o Rei será bendito
Ele nascerá do povo, ai, ai
No estandarte vai escrito
Que Ele voltará de novo
E o Rei será bendito
Ele nascerá do povo, ai, ai"
1976,O Surdo,Alcione,"Amigo, que ironia desta vida
Você chora na avenida
Pro meu povo se alegrar
Eu bato forte em você
E aqui dentro do peito uma dor
Me destrói
Mas você me entende
E diz que pancada de amor não dói
Eu bato forte em você
E aqui dentro do peito uma dor
Me destrói
Mas você me entende
E diz que pancada de amor não dói
Meu surdo, parece absurdo
Mas você me escuta
Bem mais que os amigos lá do bar
Não deixa que a dor
Mais lhe machuque
Pois pelo seu batuque
Eu dou fim ao meu pranto e começo a cantar
Meu surdo, bato forte no seu couro
Só escuto este teu choro
Que os aplausos vêm pra consolar
Amigo, que ironia desta vida
Você chora na avenida
Pro meu povo se alegrar
Eu bato forte em você
E aqui dentro do peito uma dor
Me destrói
Mas você me entende
E diz que pancada de amor não dói
Eu bato forte em você
E aqui dentro do peito uma dor
Me destrói
Mas você me entende
E diz que pancada de amor não dói
Meu surdo, velho amigo e companheiro
Da avenida e de terreiro
De rodas de samba e de solidão
Não deixe que eu vencido de cansaço
Me descuide desse abraço
E desfaça o compasso do passo do meu coração
Mas você me entende
E diz que pancada de amor não dói
Mas você me entende
E diz que pancada de amor não dói
Mas você me entende
E diz que pancada de amor não dói"
1958,Cabecinha No Ombro (part. Roberta Miranda),Fagner,"Encosta a tua cabecinha no meu ombro e chora
E conta logo a tua mágoa toda para mim
Quem chora no meu ombro eu juro que não vai embora,
Que não vai embora
Que não vai embora
Encosta a tua cabecinha no meu ombro e chora
E conta logo a tua mágoa toda para mim
Quem chora no meu ombro eu juro que não vai embora,
Que não vai embora
Porque gosta de mim
Amor, eu quero o teu carinho, porque eu vivo tão sozinho
Não sei se a saudade fica ou se ela vai embora,
Se ela vai embora,se ela vai embora
Não sei se a saudade fica ou se ela vai embora,
Se ela vai embora,porque gosta de mim"
1991,Everybody Everybody,Black Box,"You won't belong to me, I let you down
I walk around'n' see your night skyline
I feel the light but you don't want to stay
So lonely now, just let me off downtown
Sad and free
When I said it was over you aimed at my heart
Won't be long for I'm leavin' all my love
But I'll feel it forever, no sound's in my life
You can call that no livin', on my own so free
Everybody, everybody
Everybody, everybody
Everybody, everybody
You took me easy and then let me go
I never was, you see, that cheatin' kind
You feel all right, you never looker for me
So, it's time, I've gotta get on by"
2006,Ain't No Other Man,Christina Aguilera,"I could feel it from the start
Couldn't stand to be apart
Something 'bout you caught my eye
Somethin' moved me deep inside
Don't know what you did boy but you had it
And I've been hooked ever since
Told my mother, my brother
My sister and my friends
Told the others, my lovers
Both past and present tense
That every time I see you everything starts making sense
Ain't no other man
Can stand
Up next to you
Ain't no other man
On the planet
Does what you do
You're the kinda guy
A girl finds
In a blue moon
You got soul, you got class
You got style, you're badass
Ain't no other man it's true
Ain't no other man but you
Never thought I'd be alright
'Till you came and changed my life
What was cloudy now is clear
You're the light that I need here
You got what I want boy and I want it
So keep on giving it up
So tell your mother, your brother
Your sister and your friends
Tell the others, your lovers
Better not be present tense
'Cause I want everyone to know that you are mine
And no one else's
Ain't no other man
Can stand
Up next to you
Ain't no other man
On the planet
Does what you do
You're the kinda guy
A girl finds
In a blue moon
You got soul, you got class
You got style, you're badass
Ain't no other man it's true
Ain't no other man but you
Ain't no other
Ain't, ain't, no other (other)
Ain't no other
Ain't, ain't, no other (lover)
Ain't no other
I, I, I need no other
Ain't no other man but you
You are there when I'm a mess
You talked me down from every ledge
Give me strength, boy you're the best
You're the only one who's ever passed every test
Ain't no other man
Can stand
Up next to you
Ain't no other man
On the planet
Does what you do
You're the kinda guy
A girl finds
In a blue moon
You got soul, you got class
You got style, you're badass
Ain't no other man it's true
Ain't no other man but you
And now I'm telling you
Said ain't no other man but you
Ain't no other man
Can stand
Up next to you
Ain't no other man
On the planet
Does what you do
You're the kinda guy
A girl finds
In a blue moon
You got soul, you got class
You got style, you're badass
Ain't no other man it's true
Ain't no other man but you"
1978,For Once In My Life,Stevie Wonder,"For once in my life I have someone who needs me
Someone I've needed so long
For once, unafraid, I can go where life leads me
And somehow I know I'll be strong
For once I can touch what my heart used to dream of
Long before I knew
Someone warm like you
Would make my dreams come true
For once in my life I won't let sorrow hurt me
Not like it hurt me before
For once, I have something I know won't desert me
I'm not alone anymore
For once, I can say, this is mine, you can't take it
As long as I know I have love, I can make it
For once in my life, I have someone who needs me"
1964,Um Leão Está Solto nas Ruas,Roberto Carlos,"Um leão está solto nas ruas
Foi descuido do seu domador
Sei que ele está faminto
Não come desde ontem
Preciso encontrar o meu amor
Um leão está solto nas ruas
Já faz um dia que ele fugiu
A turma está aflita
Pra vê-lo outra vez
Na jaula de onde ele saiu
Você, que está em casa, um conselho vou dar:
Feche as janelas, tranque bem o portão
Pois num dado momento sem ninguém esperar
Pode aparecer o tal leão, ha
Mas um leão está solto nas ruas
Calamidade igual nunca vi
Jamais terá problemas
De alimentação
Se ele encontra o meu broto por aí
Você, que está em casa, um conselho vou dar:
Feche as janelas, tranque bem o portão
Pois num dado momento sem ninguém esperar
Pode aparecer o tal leão, ha
Um leão está solto nas ruas
Calamidade igual nunca vi
Jamais terá problemas
De alimentação
Se ele encontra o meu broto por aí
Se ele encontra o meu broto por aí"
2009,Agenda,Belo,"Ornela:
Sei que pra você eu sou apenas mais um número
De uma agenda qualquer.
Com o nome trocado pra ninguém saber quem é
E quando me atende falando de um assunto que não tem nada a ver
Já sei que está dizendo que a sua namorada está perto de você
Ninguém vai entender porque te aceito assim
Mas ficar sem você é bem pior para mim
Conselhos de amor, cansei de escutar
Quem não se apaixonou,
Não pode me julgar
Dizer que eu estou errada
Deixa eu errar
Pra esse amor, quero me entregar
Quem sabe o meu dia vai chegar
Porque a vida sem você não faz sentido
Deixa eu tentar
É perigoso mas vou arriscar
Com toda a minha força vou lutar
Pra você ficar só comigo.
Belo:
Sei que você pensa que é apenas mais um número
Numa agenda qualquer
Com o nome trocado pra ninguém saber quem é
E quando eu te atendo falando de um assunto que não tem nada a ver
É que minha namorada tá sempre do meu lado
Mas eu quero você
Ninguém vai entender porque te aceito assim
Mas ficar sem você é bem pior para mim
Conselhos de amor, cansei de escutar
Quem não se apaixonou, não pode me julgar
Dizer que estou errado
Deixa eu errar
Pra esse amor eu quero me entregar
Quem sabe o meu dia vai chegar
Porque a vida sem você não faz sentido
Deixa eu tentar
É perigoso mas vou arriscar
Com toda a minha força vou lutar
Pra poder ficar só contigo."
1991,Coming Out Of The Dark,Monster High,"I've spent my life in the shadows
Creepin' 'round the corners
Tryin' to find a home to land
I've spent my nights feelin' lonely
Dreamin' of what could be
But this is where I take my stand
I might be nervous, but I'm an optimist
It's an adventure, ready to take the risk
Lookin' for monsters, lookin' for family
Could this be what I've been waiting for?
This is what I've been waiting for
Here I am, I'm comin' out of the dark (oh, oh)
Not afraid to show my secrets or my scars (oh, oh)
This is where I'm finally free
This is where I'm meant to be
Here I am, I'm comin' out of the dark
Out of the dark
So this is it, back at school, still livin' by his rules
How can I find some air to breathe?
I'm not a king, that's him, and no one tells him: No
I just need a chance to find my wings
I might be nervous, but I'm an optimist
It's an adventure, ready to take the risk
I see the monsters, they look like family
This is what I've been waitin' for
Here I am, I'm comin' out of the dark (oh, oh)
Not afraid to show my secrets or my scars (oh, oh)
This is where I'm finally free
This is where I'm meant to be
Here I am, I'm comin' out of the dark
Out of the dark
I might be nervous, but I'm an optimist
It's an adventure, ready to take the risk
I see the monsters, they look like family
This is what I've been waitin' for
Here I am, I'm comin' out of the dark (oh, oh)
Not afraid to show my secrets or my scars (oh, oh)
This is where I'm finally free
This is where I'm meant to be
Here I am, I'm comin' out of the dark
Out of the dark"
1995,Trilhas,Guilherme Arantes,"traços de nanquim
não se apagam com o tempo
se era frágil assim
porque é o mesmo sentimento ?
trilhas que o amor deixa em nós
quem vai silenciar nossa canção ?
se você fingiu
não ter volta essa viagem
uma lágrima traiu
e escorreu na maquiagem
trilhas que o amor abre em nós
quem vai poder fechar vem me guiar
quando a noite cai
cartões postais
ruas que eu andei
que adianta eu percorrer
se não me trazem mais
você ? oo-oo-o
trilhas que o amor abre em nós
quem vai poder fechar pelo pouco que sei, foi demais"
1963,Wipe Out,Raimundos,"Corte na vala moleque doido rasgando feito uma bala
O toco podre roda o leque e se dormir lá dentro o sono some
É no barril que a gente esquece do nome
Que o couro come e o pau rela no chão que rala
Pra entrar você não é tão forte quanto pensa
A reza é braba Iemanjá foi quem mandou a bença
Para te lavar chegou a sua vez de ir pro fundo
Pegue ar e se prepare pra acordar em outro mundo
Wipe Out eu não consigo varar
Wipe Out é a maquina de lavar
Wipe Out eu te falei que a bancada aqui é rasa
Wipe Out eu não consigo varar
Wipe Out a betoneira do mar
Wipe Out bate uma foto, eu preciso de uma foto
Se eu fosse você botava pra baixo ia lascar o peito no deck dafrente
Cortava mostrando os dentes com o pé na cabeça braço nascostas
Eu te falei que eu só deixo ficar aqui gente que gosta
A diversão é o principal, a seleção é natural
Pra ficar com a mente limpa uma lavada com água e sal
Pensa logo, corre logo e vare antes que ela cresça
Me mandaram jogar mais uma série na sua cabeça
Wipe Out eu não consigo varar
Wipe Out é a maquina de lavar
Wipe Out eu te falei que a bancada aqui é rasa
Wipe Out eu não consigo varar
Wipe Out a betoneira do mar
Wipe Out bate uma foto, eu preciso de uma foto"
1996,Recado À Minha Amada (Lua Vai),Katinguelê,"Lua vai
Iluminar os pensamentos dela
Fala pra ela que sem ela eu não vivo
Viver sem ela é o meu pior castigo
Vai dizer
Que se ela for eu vou sentir saudades
Dos velhos tempos que a felicidade
Reinava em nossos pensamentos
Lua
Lua vai
Iluminar os pensamentos dela
Fala pra ela que sem ela eu não vivo
Viver sem ela é o meu pior castigo
Vai dizer
Que se ela for eu vou sentir saudades
Dos velhos tempos que a felicidade
Reinava em nossos pensamentos
Lua
Lua vai dizer
Que a minha paz depende da vontade
E da bondade vinda dessa moça
Em perdoar meus sentimentos
Lua
Ora vai dizer
Que ela sem mim não tem felicidade
Que moça igual não há pela cidade
Mande o recado a minha amada, oh Lua
Lua vai
Iluminar os pensamentos dela
Fala pra ela que sem ela eu não vivo
Viver sem ela é o meu pior castigo
Vai dizer
Que se ela for eu vou sentir saudades
Dos velhos tempos que a felicidade
Reinava em nossos pensamentos
Lua
Lua vai dizer
Que a minha paz depende da vontade
E da bondade vinda dessa moça
Em perdoar meus sentimentos
Lua
Ora vai dizer
Ela sem mim não tem felicidade
Que moça igual não há pela cidade
Mande o recado a minha amada, oh Lua
Lua vai
Iluminar os pensamentos dela
Fala pra ela que sem ela eu não vivo
Viver sem ela é o meu pior castigo
Vai dizer
Que se ela for eu vou sentir saudades
Dos velhos tempos que a felicidade
Reinava em nossos pensamentos
Lua"
1987,Eu Gosto De Mulher,Ultraje a Rigor,"Vou te contar o que me faz andar
Se não é por mulher não saio nem do lugar
Eu já não tento nem disfarçar
Que tudo que eu me meto é só pra impressionar
Mulher de corpo inteiro
Não fosse por mulher eu nem era roqueiro
Mulher que se atrasa, mulher que vai na frente
Mulher dona de casa, mulher pra presidente
Mulher de qualquer jeito
Você sabe que eu adoro um peito
Peito pra dar de mamar
E peito só pra enfeitar
Mulher faz bem pra vista
Tanto faz se ela é machista ou se é feminista
Cê pode achar que é um pouco de exagero
Mas eu sei lá, nem quero saber
Eu gosto de mulher, eu gosto de mulher
Eu gosto de mulher
Ooo ooo ooo oo
Eu gosto é de mulher!
Ooo ooo ooo oo
Eu gosto é de mulher!
Ooo ooo ooo oo
Eu gosto é de mulher!
Ooo ooo ooo oo
Eu gosto é de mulher!
Ooo ooo ooo oo
Eu gosto é de mulher!
Nem quero que você me leve a mal
Eu sei que hoje em dia isso nem é normal
Eu sou assim meio atrasadão
Conservador, reacionário e caretão
Pra quê ser diferente
Se eu fico sem mulher eu fico até doente
Mulher que lava roupa, mulher que guia carro
Mulher que tira a roupa, mulher pra tirar sarro
Mulher eu já provei
Eu sei que é bom demais, agora o resto eu não sei
Sei que eu não vou mudar
Sei que eu não vou nem tentar
Desculpe esse meu defeito
Eu juro que não é bem preconceito
Eu tenho amigo homem, eu tenho amigo gay
Olha eu sei lá, eu sei que eu não sei
Eu gosto é de mulher
Eu gosto é de mulher
Eu adoro mulher!
Eu não vivo sem mulher!"
1964,Filme Triste,Chico César,"Meu broto me avisou que ia estudar
E ao cinema eu fui me distrair
E ao chegar nem pude acreditar
Eu vi meu bem sentado com alguém em frente a mim
Os dois agarradinhos eu notei
A minha melhor amiga me traiu
Trocavam beijos que eu quase morri
E do principio ao fim do filme eu chorei
Oh oh oh, filme triste que me fez chorar
Oh oh oh filme triste que me fez chorar
E ao chegar em casa mamãe viu
Os meus olhos vermelhos de chorar
E abraçada a ela eu expliquei
Mamãe o filme foi tão triste que eu chorei
Oh oh oh, filme triste que me fez chorar
Oh oh oh filme triste que me fez chorar
Filme triste que me fez chorar"
1960,Devolva-Me,Adriana Calcanhotto,"Rasgue as minhas cartas
E não me procure mais
Assim será melhor, meu bem!
O retrato que eu te dei
Se ainda tens, não sei
Mas se tiver, devolva-me!
Deixe-me sozinho
Porque assim
Eu viverei em paz
Quero que sejas bem feliz
Junto do seu novo rapaz
Rasgue as minhas cartas
E não me procure mais
Assim vai ser melhor, meu bem!
O retrato que eu te dei
Se ainda tens, não sei
Mas se tiver, devolva-me!
O retrato que eu te dei
Se ainda tens, não sei
Mas se tiver
Devolva-me!
Devolva-me!
Devolva-me!"
