ano,nome_musica,artista,letra
2006,Se Quiser,Tânia Mara,"Se quiser fugir
Pra qualquer lugar que for
Nem precisa me chamar
Tão perto que eu estou
Mas seu medo de perder
Não te deixa me olhar
Esqueça o que passou
Que tudo vai mudar
Agora eu posso ser seu anjo
Seus desejos sei de cor
Pro bem e pro mal
Você me tem
Não vai se sentir só
Meu amor!
Sempre que quiser um beijo
Eu vou te dar
Hei! Hei! Hei! Hei!
Sua boca vai ter tanta sede
De me tomar
Se quiser!
Sempre que quiser ir às estrelas
Me dê a mão
Deixa eu te levar
Eu penso te tocar
Te falar coisas comuns
E poder te amar
O amor mais incomum
Não deixa o medo te impedir
De chegar perto de mim
O que aconteceu ontem
Não vai mais repetir
Me deixa então estar contigo
Seus desejos sei de cor
Pro bem e pro mal
Você me tem
Não vai se sentir só
Meu amor! Se quiser!
Sempre que quiser um beijo
Eu vou te dar
(Eu vou te dar!)
Sua boca vai ter tanta sede
De me tomar
Se quiser!
Sempre que quiser ir às estrelas
Me dê a mão!
Deixa eu te levar
Me deixa ser real
E te ajudar a ser feliz
Porque eu sou o seu fogo
Tudo que você quis
Tudo que você quis
Eeeeeh!
Sempre que quiser um beijo
Eu vou te dar
(Te dar!)
Sua boca vai ter tanta sede
De me tomar
(Sua boca vai! Sua boca vai!)
Se quiser!
Sempre que quiser ir as estrelas
Me dê a mão!
Deixa eu te levar
Hei! Hei! Hei! Hei!
Sempre que quiser um beijo
Eu vou te dar
(Eu vou te dar!)
Sua boca vai ter tanta sede
De me tomar
(Sua boca vai! Sua boca vai!)
Se quiser!
Sempre que quiser ir as estrelas
Me dê a mão!
Deixa eu te levar
Deixa eu te levar!
Deixa eu te levar!"
2003,Por Causa de Você,The Fevers,"Só você não vê
Finge que não sabe
Que eu estou sofrendo
Por causa de você
Sonhos que não vêm
Luzes da cidade
E eu me sinto só
Por causa de você
E eu te quero tanto
Tanto que nem sei dizer
Que a felicidade pra mim
É nunca perder você
Peço pra uma estrela
Pra te convencer enfim
Que eu não sou
Ninguém sem você
E não há você sem mim
Que eu não sou
Ninguém sem você
E não há você sem mim
Que eu não sou
Ninguém sem você
E não há você sem mim"
1990,Boys,Sabrina,"Boys, boys, boys
Boys, boys, boys
Boys, boys, boys
Boys, boys, boys
Sunshines down
So come to town
Set your body free
Hold me tight
My love tonight
Tell me you believe
Everybody, summertime love
You'll remember me
Everybody, summertime love
Be my lover, be my baby
Boys, boys, boys
I'm looking for a good time
Boys, boys, boys
Get ready for my love
Boys, boys, boys
I'm looking for the good time
Boys, boys, boys
I'm ready for your love
Stay around
The sun goes down
Babe I'm feelings right
Take a chance
With love romance
Have some fun tonight
Everybody, summertime love
You'll remember me
Everybody, summertime love
Be my lover, be my baby
Boys, boys, boys
I'm looking for a good time
Boys, boys, boys
Get ready for my love
Boys, boys, boys
I'm looking for the good time
Boys, boys, boys
I'm ready for your love
Boys and girls in the summertime love
Summertime love on the beach tonight
Say hey, say you, say me, say what
Everybody has gotta car
Don't stop, don't move
I just get your body in the groove
I said hey, I said you
I said me, I say you gotta get in the groove
Boys, boys, boys
In the summertime love, in the summertime love
Boys, boys, boys
Let's summertime roll, let's summertime roll
Boys, boys, boys
In the summertime love, in the summertime love
Boys, boys, boys
Let's summertime roll, let's summertime roll
Everybody, summertime love
You'll remember me
Everybody, summertime love
Be my lover, be my baby
Boys, boys, boys
I'm looking for a good time
Boys, boys, boys
Get ready for my love
Boys, boys, boys
I'm looking for the good time
Boys, boys, boys
I'm ready for your love"
1959,"Vai, Mas Vai Mesmo",Ataulfo Alves,"Vai vai mesmo
Eu nao quero voce mais nunca mais
Tenha a santa paciencia
Ponha a mao na consciencia
Deixe-me viver em paz
Sai de vez do meu caminho
Dê a outro seu carinho
Me abandone por favor ai que dor
Voce machucou meu peito
Nao tem mais o direito de mandar no meu amor"
2009,Passos Escuros,Hevo84,"Eu admiro o que me faz voltar
A ver a vida como eu sempre quis
Minhas verdades ninguém vai mudar
Nem apagar o que foi feito aqui
Hoje eu sou o que restou da dor
Da minha dor
Não posso me esconder
Mas que a verdade seja dita agora
Eu mudei por você
Mas não quis sofrer
Por ser tão real pra mim
Vou
Aprendo a viver
E num segundo perder
O medo de ser quem eu sou
Ser quem eu sou
Eu admiro o que me faz voltar
A ver a vida como eu sempre quis
Minhas verdades ninguém vai mudar
Nem apagar o que foi feito aqui
Hoje eu sou o que restou da dor
Da minha dor
Posso me esconder
Mas que a verdade seja dita agora
Eu mudei por você
Mas não quis sofrer
Por ser tão real pra mim
Vou
Aprendo a viver
E num segundo perder
O medo de ser quem eu sou
Ser quem eu sou
Que a vida me leve afinal
Não tenho mais medo de errar e aprender
Com meus passos escuros
Com meus passos escuros
Eu mudei por você
Mas não quis sofrer
Por ser tão real pra mim
Vou
Aprendo a viver
E num segundo perder
O medo de ser quem eu sou
Ser quem eu sou"
1994,Crazy,Gnarls Barkley,"I remember when
I remember, I remember when I lost my mind
There was something so pleasant about that place
Even your emotions had an echo
In so much space
And when you're out there, without care
Yeah, I was out of touch
But it wasn't because I didn't know enough
I just knew too much
Does that make me crazy?
Does that make me crazy?
Does that make me crazy?
Possibly
And I hope that you are having the time of your life
But think twice, that's my only advice
Come on now, who do you, who do you, who do you
Who do you think you are?
Ha, ha, ha, bless your soul
You really think you're in control?
Well, I think you're crazy
I think you're crazy
I think you're crazy
Just like me
My heroes had the heart
To lose their lives out on the limb
And all I remember is thinking: I wanna be like them
Ever since I was little
Ever since I was little, it looked like fun
And it's no coincidence, I've come
And I can die when I'm done
But maybe I'm crazy
Maybe you're crazy
Maybe we're crazy
Probably"
1975,Terceiro Ato,Luiz Carlos da Vila,"No primeiro ato
O fogo ardia em tal profusão
Uma desarmonia assim por dizer
Ao sabor da paixão
O fogo e a saudade
A extremos levados
Murmúrios morrendo
Nos lábios colados
Não demorou muito
A explosão e o sono
Dois corpos cansados
No segundo ato
Mais então das ações
Mais calma
Mais dengo
Entregas
E fugas
Pés no céu, mãos no chão
O fogo e a saudade
Então se harmonizam
E encontram os extremos com mais poesia
De versos mais longos
Que ao dar-se a explosão
Já amanhecia
Chuveiro ligado
Convite a partir da olhares trocados
Era o desafio
Aos extenuados
Que aplaudido jaziam
No palco do amor
Veio a luta de corpo e alma
Uma briga de foice
E os dois vencedores
Vivemos, de fato, o amor
Dos amores
No terceiro ato"
2011,Abelha (part. Jorge e Mateus),João Bosco e Vinícius,"Como pode, chegou em pouco tempo
Suave como o vento, me deixou assim
Como pode, mais veloz que o pensamento
Dominou meu sentimento, fez parte de mim
Mas seus pensamentos são maus
Você só pensa em vingança
E a sua segurança é dominar
Eu já não suporto mais sofrer
Quero viver
Arruma outro pra envenenar
Como uma abelha pousa numa flor
Mansa, você chegou me dando amor
Como uma abelha ferroou meu coração
Deixou saudades e o veneno da paixão
Como uma abelha pousa numa flor
Mansa, você chegou me dando amor
Como uma abelha ferroou meu coração
Deixou saudades e o veneno da paixão"
2002,Final Feliz (part. Djavan),Jorge Vercillo,"Chega de fingir
Eu não tenho nada a esconder
Agora é pra valer, haja o que houver
Não tô nem aí
Não tô nem aqui pro que dizem
Eu quero é ser feliz, e viver pra ti
Pode me abraçar sem medo
Pode encostar tua mão na minha
Meu amor
Deixa o tempo se arrastar sem fim
Meu amor
Não há mal nenhum gostar assim
Oh, meu bem
Acredite no final feliz
Meu amor, meu amor
Chega de fingir
Eu não tenho nada a esconder
Agora é pra valer, haja o que houver
Não tô nem aí
Não tô nem aqui pro que dizem
Eu quero é ser feliz, e viver pra ti
Pode me abraçar sem medo
Pode encostar sua mão na minha
Meu amor
Deixa o tempo se arrastar sem fim
Meu amor
Não há mal nenhum gostar assim
Oh, meu bem
Acredite no final feliz
Meu amor, meu amor
Pode me abraçar sem medo
Pode encostar sua mão na minha
Meu amor
Deixa o tempo se arrastar sem fim
Meu amor
Não há mal nenhum gostar assim
Oh, meu bem
Acredite no final feliz
Meu amor, meu amor"
1982,Por Debaixo dos Panos,Ney Matogrosso,"O que a gente faz
E por debaixo dos pano, pra ninguém saber
É por debaixo dos pano, se eu ganho mais
É por debaixo dos pano, ou se vou perder
É por debaixo dos pano
O que a gente faz
É por debaixo dos pano, pra ninguém saber
É por debaixo dos pano, se eu ganho mais
É por debaixo dos pano, ou se vou perder
É por debaixo dos pano
É debaixo dos pano
Que a gente não tem medo
Pode guardar segredo de tudo que se vê
É debaixo dos pano que a gente fala do fulano
E diz o que convém
É debaixo dos pano
Que eu me afogo, que eu me dano
Sem ver o bem
É debaixo dos pano
Que eu me afogo, que eu me dano
Sem ver o bem
O que a gente faz
E por debaixo dos pano, pra ninguém saber
É por debaixo dos pano, se eu ganho mais
É por debaixo dos pano, ou se vou perder
É por debaixo dos pano
O que a gente faz
É por debaixo dos pano, pra ninguém saber
É por debaixo dos pano, se eu ganho mais
É por debaixo dos pano, ou se vou perder
É por debaixo dos pano
É debaixo dos pano
Que a gente esconde tudo
E não se fica mudo, de tudo quer fazer
É debaixo dos pano
Que a gente comete um engano
Sem ninguém saber
É debaixo dos pano
Que a gente entra pelo cano
Sem ninguém ver
É debaixo dos pano
Que a gente entra pelo cano
Sem ninguém ver
O que a gente faz
E por debaixo dos pano, pra ninguém saber
É por debaixo dos pano, se eu ganho mais
É por debaixo dos pano, pra ninguém saber
É por debaixo dos pano
O que a gente faz
É por debaixo dos pano, pra ninguém saber
É por debaixo dos pano, se eu ganho mais
É por debaixo dos pano, ou se vou perder
É por debaixo dos pano
É debaixo dos pano
Que a gente esconde tudo
E não se fica mudo, de tudo quer fazer
É debaixo dos pano
Que a gente comete um engano
Sem ninguém saber
É debaixo dos pano
Que a gente entra pelo cano
Sem ninguém ver
É debaixo dos pano
Que a gente entra pelo cano
Sem ninguém ver"
2010,Video Phone (feat. Lady Gaga),Beyoncé,"Uh-uh (uh-uh)
Uh-uh (uh-uh)
Uh-uh (uh-uh)
Uh-uh (uh-uh)
Uh-uh (uh-uh)
Uh-uh (uh-uh)
Uh-uh (uh-uh)
Uh-uh (uh-uh)
Shawty, what your name is?
(Uh-uh) them hustlas keep on talkin'
(Uh-uh) they like the way I'm walkin'
(Uh-uh) you sayin' that you want me?
(Uh-uh) so press record, I'll let you film me
On your video phone (make a cameo)
Tape me on your video phone (I can handle you)
Watch me on your video phone (on your video, video)
If you want me, you can watch me on your video phone (uh-uh)
I love how you approach me
Fresh white, with your pants hangin', grown man low
Everything you sayin' soundin' good to me
No need to convince me anymore
Swag up, it's right, one blade is tight
And I smell your cologne in the air
Baby, you doin' something right
You just cancelled every other man here
You say you love my bag and the color of my nails
You can see that I got it goin' on
I wanna make sure you remember me
So I'ma leave my number on your video phone
(Uh-uh) I got no time for frontin'
(Uh-uh) I know just what I'm wantin'
(Uh-uh) if it's gonna be you and me
When I call, they better see me on your video screen
(Uh-uh) them hustlas keep on talkin'
(Uh-uh) they like the way I'm walkin'
(Uh-uh) you sayin' that you want me?
(Uh-uh) so press record, I'll let you film me
On your video phone (make a cameo)
Tape me on your video phone (I can handle you)
Watch me on your video phone (on your video, video)
If you want me, you can watch me on your video phone (uh-uh)
You my phone star
And I'm happy when my lights flashin', 'cause you on my receiver, oh
Hubba, hubba
Honey, baby is so sexy that he should win an Oscar, oh (ooh)
And when you miss me
Just remember that I always got you with me, oh (ooh)
I'll be your Gene, you'll be my Brando
I'ma put you in my movie if you think that you can handle
(Uh-uh) (can you handle it?) (Oh-woah-oh) I know you like that
(Uh-uh) (can you handle it?) Turn you into a star, I got it like that (like that)
(Uh-uh) (can you handle it?) Baby, don't fight it (tell 'em, B)
(Uh-uh) (can you handle it?) 'Cause when I miss your call, I hit you right back
On my video phone (uh-uh) (you like what you see?)
Them hustlas like my fashion (uh-uh) (you wanna video me?)
They like the way I'm walkin' (uh-uh) (you like what you see?)
You sayin' that you want me (go on and video me)
(Uh-uh) so press record, I'll let you film me
On your video phone (make a cameo)
Tape me on your video phone, oh (I can handle you)
Watch me on your video phone, oh (on your video, video)
If you want me, you can watch me on your video phone
Can you handle it?
Can you handle it? (Tell 'em, B)
Can you handle it?
Can you handle it?
You like what you see? (Uh-uh) (can you handle it?)
You wanna video me? (Uh-uh) (can you handle it?)
You like what you see? (Uh-uh) (can you handle it?)
(Oh) go on and video me (uh-uh) (can you handle it?)
(Oh) you like what you see?
(Can you handle it?) You wanna video me?
You know them G's, they be hollerin'
'Specially them hot ones (uh-uh)
Brooklyn, Atlanta, Houston, to New Orleans
When they see me, they be like: Yo, B, let me call you (uh-uh)
You breakin' my focus, boy, you cute and you ballin' (uh-uh)
You like it when I shake it? (Uh-uh)
Shawty on a mission, what your name is? (Uh-uh)
What? You want me naked? (Uh-uh)
If you likin' this position, you can tape it
On your video phone (uh-uh)
Hustla keep on talkin' (uh-uh)
You like the way it's poppin' (poppin', poppin') (uh-uh)
You sayin' that you want me (you want me) (uh-uh)
Press record and, baby, film me
On your video phone (uh-uh) (make a cameo) (film me)
Tape me on your video phone (uh-uh) (I can handle you) (film me)
Watch me on your video phone (uh-uh) (on your video, video)
If you want me, you can watch me on your video phone
Uh-uh-uh-ah-uh
Uh-uh-uh-ah-uh
Uh-uh-uh-ah
Video phone"
2003,Não Falamos do Bruno,Encanto (Disney),"Não falamos do Bruno, não, não, não
Não falamos do Bruno, mas
Íamos nos casar (íamos nos casar)
Tudo estava pronto, não havia uma nuvem no céu (nada de nuvens no céu)
Bruno chegou, já tocando o terror (trovão)
Cê quer assumir o meu papel? (Desculpa, mi vida, vai lá)
Bruno diz que vai chover (e adivinha)
E eu começo a me perder (abuela, pega a sombrinha)
Já começa a escurecer (foi a perfeição, mas desde então)
Não falamos do Bruno, não, não, não
Não falamos do Bruno
Ei, eu cresci com medo de escutá-lo gaguejando
Posso até ouvir o som do Bruno murmurando
Com um som de areia que não para de escorrer, ts, ts, ts
Bruno com seu dom foi nos assustando
Toda a família foi aos poucos pirando
Com suas profecias tão difíceis de entender
Dá pra entender?
Ser abismal, vive no porão
Se chamar o tal, verás o apagão
Quando for dormir, vai te consumir (ei)
Não falamos do Bruno, não, não, não
Não falamos do Bruno
Falou: Seu peixe irá morrer, e morreu (não, não)
Previu o meu barrigão, e deu no que deu (não, não)
Me disse: Seu cabelo vai cair, e aconteceu (não, não)
Não vai fugir se a sorte te escolher!
Me falou que a vida ideal
Num momento, viria pra mim
Me falou: Seu poder vai crescer
Como as vinhas deste jardim (hoje, Mariano vem aí)
Me falou que o homem pra mim
Não seria só meu
Seria de outra
Escuto a sua voz (nem vem)
Escuto a sua voz (não quero ouvir nem um pio)
Ouço a sua voz
Hmm, Bruno
Sim, sobre o Bruno
Eu tenho que entender quem é o Bruno
Então me diga a verdade, Bruno (Isabela, seu boy chegou)
Tá na mesa
Ser abismal, vive no porão (íamos nos casar, íamos nos casar)
Se chamar o tal, verás o apagão (tudo estava pronto, não havia uma nuvem no céu)
Quando for dormir, vai te consumir (Bruno chegou, já tocando o terror)
Você quer assumir o meu papel?
Hoje Mariano vem aí
Bruno diz que vai chover (me falou que o homem pra mim não seria só meu)
E eu começo a me perder (seria de outra, outra)
Já começa a escurecer
Chegou
Não fale do Bruno, não, não
Por que eu falei sobre o Bruno? (Não mencione o Bruno)
Eu não sei porque eu falei sobre o Bruno"
2005,É Amor Demais,Edson e Hudson,"O que você tem? Diz pra mim
Posso ver nos teus olhos
Vem diz, pra mim
O que for, tô aqui
Faço tudo pra te ver novamente sorrir
Tô cansado de te ver sofrer
Por alguém que não soube te amar
Vendo tudo isso acontecer
É o momento de me declarar
É amor demais! É coisa de Deus
Verdadeiro e profundo são os sonhos meus
É amor! Sem maldade
Sentimento nasceu da mais pura amizade
Desculpa, não quero te assustar
Mas se quer um amor de verdade
Tô aqui pra te dar
Tô cansado de te ver sofrer
Por alguém que não soube te amar
Vendo tudo isso acontecer
É o momento de me declarar
É amor demais! É coisa de Deus
Verdadeiro e profundo são os sonhos meus
É amor! Sem maldade
Sentimento nasceu da mais pura amizade
Desculpa, não quero te assustar
Mas se quer um amor de verdade
Tô aqui pra te dar
É amor demais! É coisa de Deus
Verdadeiro e profundo são os sonhos meus
É amor! Sem maldade
Sentimento nasceu da mais pura amizade
Desculpa, não quero te assustar
Mas se quer um amor de verdade
Tô aqui pra te dar
Pra te dar"
1995,Vem Me Dar Um Beijo,Fundo de Quintal,"Menina, vem me dar um beijo, amor
Misturando com o meu tempero
Aquele teu olhar me apaixonou
Eu quero ser o teu primeiro
Sabendo do caso do ex-namorado
Que fez um descaso
Traiu seu amor
Quem sabe agora é chance da gente
Fechar a corrente com o nosso calor
Levando a sério nosso compromisso
Cortar o feitiço que o tempo deixou
Quebrar o olho grande, a inveja, a cobiça
Rezar um missa pro seu ex-amor
Menina, vem me dar um beijo, amor
Misturando com o meu tempero
Aquele teu olhar me apaixonou
Eu quero ser o teu primeiro
Já sinto firmeza, vai dar tudo certo
O elo fechado não vai se romper
Estamos mais perto de um entendimento
Um bom casamento já dá pra se ver
A nossa alegria vai ser de verdade
O mel será pouco pra satisfazer
Então vem correndo
Me cubra de beijos
Que o fim da novela
Dá eu e você"
1991,Heal The Pain,George Michael,"Let me tell you a secret
Put it in your heart and keep it
Something that I want you to know
Do something for me
Listen to my simple story
And maybe we'll have something to show
You tell me you're cold on the inside
How can the outside world
Be a place that your heart can embrace
Be good to yourself
'Cause nobody else
Has the power to make you happy
How can I help you?
Please let me try to
I can heal the pain
That you're feeling inside
Whenever you want me
You know that I will be
Waiting for the day
That you say you'll be mine
He must have really hurt you
To make you say the things that you do
He must have really hurt you
To make those pretty eyes look so blue
He must have known
That he could
That you'd never leave him
Now you can't see my love is good
And that I'm not him
How can I help you?
Please let me try to
I can heal the pain
Won't you let me inside?
Whenever you want me
You know that I will be
Waiting for the day
That you say you'll be mine
Won't you let me in?
Let this love begin
Won't you show me your heart now?
I'll be good to you
I can make this thing true
Show me that heart right now
Who needs a lover
That can't be a friend
Something tells me I'm the one you've been looking for
If you ever should see him again
Won't you tell him you've found someone who gives you more
Someone who will protect you
Love and respect you
All those things
That he never could bring to you
Like I do
Or rather I would
Won't you show me your heart like you should?
How can I help you?
Please let me try to
I can heal the pain
That you're feeling inside
Whenever you want me
You know that I will be
Waiting for the day
That you say you'll be mine
Won't you let me in?
Let this love begin
Won't you show me your heart now?
I'll be good to you
I can make this thing true
And get to your heart somehow"
1982,Então Tá,As Aventuras de Poliana (Novela),"Não adianta nem tentar
Dessa vez você não vai ganhar
Fica só me olhando
Admirando, apreciando o meu encanto
É que eu fico muito bem
É que eu fico muito bem sozinha
É que quando estou com alguém
Estou com as poderosas, fiéis amigas
Então tá! Fica aí no seu lugar
Então tá! Chega desse blá, blá, blá
Então tá! Hoje eu não vou parar
Então tá! Sai da frente que eu quero passar
Marcou bobeira, mas não foi de primeira
Pensou que era malandra, agora só come poeira
Senta e chora que a menina aqui vai desfilar
De Paco Rabane, eu nasci foi pra brilhar
Se me ligar vai ouvir ocupada tu tu tu
Agenda lotada, garota invocada, zona sul
Pega e sai e nem vem, nem se importa
Dá meia volta que hoje eu tô de folga"
2013,Play Hard (feat. Ne-Yo & Akon),David Guetta,"Come on, baby, and drop this
Scrub that floor and just mop it
Show these gangsters how you pop lock it
Don't care what you got in your pocket
I get the way that you rockin'
Flip that thang thang don't stop it
When I just bang bang and pop it
While the club crowded just watch you (work it out)
Got a gang of cash, and it's going all on the bar (now work it out)
And it's going fast, 'cause I feel like a superstar (now work it out)
And you may not have it, I might just broke the law (now work it out)
It's your time to grab it, now make this whole thing yours (now work it out)
Hey, said a hustler's work is never through
We makin' it, 'cause we make it move
The only thing we know how to do
Said it's the only thing we know how to do
Work hard, play hard
Work hard, play hard
We work hard, play hard
Keep partyin' like it's your job
Work hard, play hard
Work hard, play hard
We work hard, play hard
Keep partyin' like it's your job
Yes, I'm fresh-to-death lookin' plush
Ladies can't get enough
Got my fitness, I'm looking buff
And all my people with me, I trust
Holdin' down for my city
If they askin' you, I'm not guilty
All the thing that I'm guilty of is making you rock with me (work it out)
Got a gang of cash, and it's going all on the bar (now work it out)
And it's going fast, 'cause I feel like a superstar (now work it out)
And you may not have it, I might just broke the law (now work it out)
It's your turn to grab it, now make this whole thing yours (now work it out)
Hey, said a hustler's work is never through
We makin' it, 'cause we make it move
The only thing we know how to do
Said it's the only thing we know how to do
Work hard, play hard
Work hard, play hard
We work hard, play hard
Keep partyin' like it's your job
Work hard, play hard
Work hard, play hard
We work hard, play hard
Keep partyin' like it's your job
Hey, said a hustler's work is never through
We makin' it, 'cause we make it move
The only thing we know how to do
Said it's the only thing we know how to do
Work hard, play hard
Work hard, play hard
We work hard, play hard
Keep partyin' like it's your job
Work hard, play hard
Work hard, play hard
We work hard, play hard
Keep partyin' like it's your job"
1989,Tieta,Luiz Caldas,"Vem meu amor, vem com calor
No meu corpo se enroscar
Vem minha flor, vem sem pudor
Em seus braços me matar
Vem meu amor, vem com calor
No meu corpo se enroscar
Vem minha flor, vem sem pudor
Em seus braços me matar
Tieta não foi feita
Da costela de Adão
É mulher diabo
Minha própria tentação
Tieta é a serpente
Que encantava o paraíso
Ela veio ao mundo
Pra virar nosso juízo
Tieta, Tieta
Pelos olhos de Tieta
Me deixei guiar
Tieta, Tieta
No ventre de Tieta
Encontrei o meu lugar
Tieta, Tieta
Nos seios de Tieta
Construí meu ninho
Na boca de Tieta
Morri como um passarinho
Vem meu amor, vem com calor
No meu corpo se enroscar
Vem minha flor, vem sem pudor
Em seus braços me matar
Vem meu amor, vem com calor
No meu corpo se enroscar
Vem minha flor, vem sem pudor
Em seus braços me matar
Tieta do Agreste
Lua cheia de tesão
É Lua, estrela, nuvem
Carregada de paixão
Tieta é fogo ardente
Queimando o coração
Seu amor mata a gente
Mais que o sol do meu sertão
Vem meu amor, vem com calor
No meu corpo se enroscar
Vem minha flor, vem sem pudor
Em seus braços me matar
Tieta do Agreste
Lua cheia de tesão
É Lua, estrela, nuvem
Carregada de paixão
Tieta é fogo ardente
Queimando o coração
Seu amor mata a gente
Mais que o sol do meu sertão"
