ano,nome_musica,artista,letra
1994,O Chamado,Leandro Borges,"Sempre que eu olho pra mim mesmo
E percebo o quão pequeno que eu sou
O chamado é maior que a minha capacidade
Dá vontade de dizer: Hoje eu não vou
Dizer eis-me aqui é uma escolha
É um caminho que não dá pra retornar
É possível, mas já tenho a consciência
Que seguir é bem mais fácil que voltar
Elogios não satisfazem minha alma
Os aplausos não compensam o que já sacrifiquei
E o dinheiro nunca poderá comprar
Minha vida que no altar já entreguei
Eu vejo que a estrada é bem longa
E já percebi que fácil não será
Meu Deus, se não fores comigo
Nenhum passo adiante eu quero dar
Quando eu pensar em desistir
Me abraça e diz: Estou aqui
A Tua voz é o que me orienta
O que me acalenta é poder Te sentir
Quando os meus pés se cansarem de andar
Me leva nos braços, eu não posso parar
De tudo o que sei, a maior certeza
É que não sou nada sem a Tua presença"
1967,Felizes Juntinhos,Os Canibais,"Você e eu
Nós dois, depois
Uma canção de amor e paz
Pra se cantar
A noite a lua então virá
Só pra nós dois
Felizes juntinhos
É tão gostoso ouvir
Você falar
Que o nosso amor
Jamais meu bem
Vai se acabar
Que nós seremos
Sempre dois
Para sonhar
Felizes juntinhos
Nada mais existe
Na vida pra mim
Senão você
Sem você eu juro
O futuro será
Tão mal pra mim
E depois vamos sorrir
A sorte é que dirá então
O que há de vir
E seja o que for amor
Vai nos achar
Felizes juntinhos
Pá pá pá pá
Felizes juntinhos"
1970,I'll Be There,Michael Jackson,"You and I must make a pact
We must bring salvation back
Where there is love
I'll be there (I'll be there)
I'll reach out my hand to you (oh)
I'll have faith in all you do
Just call my name
And I'll be there (I'll be there)
And, oh, I'll be there to comfort you
Build my world of dreams around you
I'm so glad that I found you
I'll be there with a love that's strong
I'll be your strength
I'll keep holding on
(Holding on, holding on) yes, I will, yes, I will
Let me fill your heart with joy and laughter
Togetherness, well, that's all I'm after
Whenever you need me
I'll be there (I'll be there)
I'll be there to protect you (yeah, baby)
With an unselfish love I respect you (oh)
Just call my name
And I'll be there (I'll be there)
And, oh, I'll be there to comfort you
Build my world of dreams around you
I'm so glad that I found you
I'll be there with a love that's strong
I'll be your strength
I'll keep holding on
(Holding on, holding on) yes, I will, yes, I will
If you should ever find someone new
I know he'd better be good to you
'Cause if he doesn't
I'll be there (I'll be there)
Don't you know, baby? Yeah, yeah
I'll be there
I'll be there
Just call my name, I'll be there (I'll be there)
(Just look over your shoulders, honey, oh)
I'll be there
I'll be there
Whenever you need me, I'll be there (I'll be there)
Don't you know, baby? Yeah, yeah
I'll be there
I'll be there
Just call my name, (I'll be there) I'll be there
Oh, oh, oh, oh
I'll be there"
2007,Pra Não Morrer de Amor,Bruno e Marrone,"Melhor, se me avisasse
Porque, levou meus sonhos
Talvez, foi minha covardia
Por não dizer-te nunca
Que te queria
Chorei, te lembrando
Gritei, desabafando
E hoje, me resta esperança
De ter você de volta
Não penso em mais nada
Eu tento todo dia e não consigo
Viver sem teu calor
O tempo passa mas em minha vida
Meu mundo perde a cor
Eu vou vivendo sem achar motivo
Como esquecer a dor
Talvez encontre a luz da minha vida
Pra não morrer de amor
A paz, que eu busco tanto
Porque, deixei das mãos escapar
Por Deus, eu deixo a porta aberta
Com a esperança sempre
De ver você voltar
Eu tento todo dia e não consigo
Viver sem teu calor
O tempo passa mas em minha vida
Meu mundo perde a cor
Eu vou vivendo sem achar motivo
Como esquecer a dor
Talvez encontre a luz da minha vida
Pra não morrer de amor
Eu tento todo dia e não consigo
Viver sem teu calor
O tempo passa mas em minha vida
Meu mundo perde a cor
Eu vou vivendo sem achar motivo
Como esquecer a dor
Talvez encontre a luz da minha vida
Pra não morrer de amor"
1990,It Must Have Been Love,Roxette,"(It must have been love, but it's over now)
Lay a whisper on my pillow
Leave the winter on the ground
I wake up lonely, there's air of silence
In the bedroom and all around (and all around)
Touch me now
I close my eyes
And dream away
It must have been love, but it's over now
It must have been good, but I lost it somehow
It must have been love, but it's over now
From the moment we touched 'til the time had run out
Make-believing we're together
That I'm sheltered by your heart
But in and outside, I've turned to water
Like a teardrop in your palm
And it's a hard
Winter's day
I dream away
It must have been love, but it's over now
(It must have been love, but it's over now)
It was all that I wanted, now I'm living without
It must have been love, but it's over now
(It must have been love, the wind blows)
It's where the water flows
It's where the wind blows
It must have been love, but it's over now
(It must have been love, but it's over now)
It must have been good, but I lost it somehow
It must have been love, but it's over now
(It must have been love, but it's over now)
From the moment we touched 'til the time had run out
Yeah, it must have been love, but it's over now
(It must have been love, but it's over now)
It was all that I wanted, now I'm living without
It must have been love, but it's over now
(The wind blows)
It's where the water flows
It's where the wind blows
(It must have been love, but it's over now)
But it's over now
Now
(It must have been love, but it's over now)
(It must have been love, but it's over now)
Now"
1965,Help!,The Beatles,"(Help)
I need somebody
(Help)
Not just anybody
(Help)
You know I need someone
(Help)
When I was younger, so much younger than today
I never needed anybody's help in any way
But now these days are gone, I'm not so self assured
Now I find I've changed my mind and opened up the doors
Help me if you can, I'm feeling down
And I do appreciate you being 'round
Help me get my feet back on the ground
Won't you please, please help me?
And now my life has changed in, oh, so many ways
My independence seems to vanish in the haze
But every now and then I feel so insecure
I know that I just need you like I've never done before
Help me if you can, I'm feeling down
And I do appreciate you being 'round
Help me get my feet back on the ground
Won't you please, please help me?
When I was younger, so much younger than today
I never needed anybody's help in any way
But now these days are gone, I'm not so self assured
Now I find I've changed my mind and opened up the doors
Help me if you can, I'm feeling down
And I do appreciate you being 'round
Help me get my feet back on the ground
Won't you please, please help me?
Help me, help me, oh"
2010,As Máscaras,Claudia Leitte,"Don't mask
Don't mask
Just dance
As máscaras vão cair
E tudo que você vestiu agora você vai despir
Dubidubidabidu
Hahahahahahaha
Tire o fone do ouvido
Sinta o som que vem do chão
Sacudindo os sentidos
Vem comigo
Atenção
Deixa a onda te levar
Na pista, na rua, no ar
Deixa a música dizer
Como você vai dançar
Levanta, sacode, balança
Não pode parar
Se lança, se joga na dança
Se deixa levar
Levanta, sacode, balança
Não pode parar
Se lança, se joga na dança
Se deixa levar
Tire o fone do ouvido
Sinta o som que vem do chão
Sacudindo os sentidos
Vem comigo
Atenção
Deixa a onda te levar
Na pista, na rua, no ar
Deixa a música dizer
Como você vai dançar
Levanta, sacode, balança
Não pode parar
Se lança, se joga na dança
Se deixa levar
Levanta, sacode, balança
Não pode parar
Se lança, se joga na dança
Se deixa levar
Liberte sua mente do que a mentira contou
Vista-se com o novo
Dispa-se da máscara
Venha quem quiser e seja como for
Levanta, sacode, balança
Não pode parar
Se lança, se joga na dança
Se deixa levar
Levanta, sacode, balança
Não pode parar
Se lança, se joga na dança
Se deixa levar
Se deixa levar"
1962,Crying In The Rain,a-ha,"I'll never let you see
The way my broken heart is hurting me
I've got my pride and I know how to hide
All my sorrow and pain
I'll do my crying in the rain
If I wait for stormy skies
You won't know the rain from the tears in my eyes
You'll never know that I still love you so
Only heartaches remain
I'll do my crying in the rain
Raindrops falling from heaven
Could never take away my misery
Since we're not together
I pray for stormy weather
To hide these tears I hope you'll never see
Someday, when my crying is done
I'm gonna wear a smile and walk in the Sun
I may be a fool but till then
Darling, you'll never see me complain
I'll do my crying in the rain
Uh, uh, uh, uh
Since we're not together
I pray for stormy weather
To hide these tears I hope you'll never see
Someday when my crying is done
I'm gonna wear a smile and walk in the Sun
I may be a fool but till then
Darling, you'll never see me complain
I'll do my crying in the rain
I'll do my crying in the rain
I'll do my crying in the rain"
1998,Something About The Way You Look Tonight,Elton John,"There was a time
I was everything and nothing all in one
When you found me
I was feeling like a cloud across the Sun
Well, I need to tell ya
How you light up every second of the day
But in the moonlight
You just shine like a beacon on the bay
And I can't explain
But it's something about the way you look tonight
Takes my breath away
It's that feeling I get about you deep inside
And I can't describe
But it's something about the way you look tonight
Takes my breath away
The way you look tonight
With a smile
You pull the deepest secrets from my heart
In all honesty
I'm speechless and I don't know where to start
And I can't explain
But it's something about the way you look tonight
Oh, takes my breath away
It's that feeling I get about you deep inside
And I can't describe
But it's something about the way you look tonight
Takes my breath away
The way you look tonight
The way you look tonight
The way you look tonight
The way you look tonight
The way you look tonight
The way you look tonight
The way you look tonight
(The way you look) the way you look tonight
The way you look tonight"
1993,Please Forgive Me,Bryan Adams,"It still feels like our first night together
It feels like the first kiss
And it's getting better, baby
No one can better this
Still holding on, you're still the one
The first time our eyes met
It's the same feeling I get
Only feels much stronger
I wanna love you longer
Do you still turn the fire on?
So, if you're feeling lonely, don't
You're the only one I'll ever want
I only wanna make it good
So, if I love you a little more than I should
Please, forgive me, I don't know what I do
Please, forgive me, I can't stop loving you
Don't deny me, this pain I'm going through
Please, forgive me if I need you like I do
Please, believe me, every word I say is true
Please, forgive me, I can't stop loving you
Still feels like our best times together
Feels like the first touch
We're still getting closer, baby
Can't get close enough
Still holding on, you're still number one
I remember the smell of your skin
I remember everything
I remember all your moves
I remember you, yeah
I remember the nights
You know I still do
So, if you're feeling lonely, don't
You're the only one I'll ever want
I only wanna make it good
So, if I love you a little more than I should
Please, forgive me, I don't know what I do
Please, forgive me, I can't stop loving you
Don't deny me, this pain I'm going through
Please, forgive me if I need you like I do
Oh, believe me, every word I say is true
Please, forgive me, I can't stop loving you
The one thing I'm sure of is the way we make love
The one thing I depend on is for us to stay strong
With every word and every breath, I'm praying
That's why I'm saying
Please, forgive me, I don't know what I do
Please, forgive me, I can't stop loving you
Don't deny me, this pain I'm going through
Please, forgive me if I need you like I do
Baby, believe me, every word I say is true
Please, forgive me, I can't stop loving you
Now, believe me, I don't know what I do
Please, forgive me, I can't stop loving you
Yeah, I can't stop loving you"
2012,Dança Kuduro (part. Daddy Kall),Latino,"Dança, Kuduro!
Vem Latino, Daddy Kall!
Mão pra cima, cintura solta
Dá meia volta, dança Kuduro
Não se canse agora, começou a festa
Mexe a cabeça, dança Kuduro!
Mão pra cima, cintura solta
Dá meia volta, sacode tudo
Não se canse agora, começou a festa
Mexe a cabeça, dança Kuduro
Quem pode domar a força
Que entra nas suas veias?
Fica quente gruda na gente
Ferve, esquenta, incendeia
E quem pode parar isso aqui
Descontrola sua cadeira
Esse fogo que queima por dentro
E lento tudo me tempera
A mão pra cima, cintura solta
Dá meia volta e sacode duro
Não se canse agora, começou a festa
Mexe a cabeça e sacode duro
Balança que é uma loucura
Morena vem do meu lado
Ninguém vai ficar parado
Quero ver mexer Kuduro
Balança que é uma loucura
Morena vem do meu lado
Ninguém vai ficar parado
Oi, oi, oi, oi, oi, oi, oi?
É para quebrar Kuduro, vamos dançar Kuduro
Oi, oi, oi, oi, oi, oi, oi?
Seja morena ou loira, vem balançar Kuduro
Oi, oi, oi?
A mão pra cima, cintura solta
Da meia volta, dança Kuduro
Não se canse agora começou a festa
Mexe a cabeça e dança Kuduro
A mão pra cima, cintura solta
Da meia volta, dança Kuduro
Não se canse agora começou a festa
Mexe a cabeça e dança Kuduro
Balança que é uma loucura
Morena vem do meu lado
Ninguém vai ficar parado
Quero ver mexer Kuduro
Balança que é uma loucura
Morena vem do meu lado
Ninguém vai ficar parado
Oi, oi, oi, oi, oi, oi, oi?
É para quebrar kuduro, vamos dançar kuduro
Oi, oi, oi, oi, oi, oi, oi?
Seja morena ou loira, vem balançar kuduro
Oi, oi, oi?
(Dança Kuduro)
A mão pra cima, cintura solta
Da meia volta, dança Kuduro
Não se canse agora começou a festa
Mexe a cabeça e dança Kuduro
Mão pra cima, cintura solta
Dá meia volta, dança Kuduro
Não se canse agora começou a festa
Mexe a cabeça e dança Kuduro"
1972,Heart of Gold,Shawn Mendes,"(Ooh)
Honestly
It's been a while since I thought of you
In the end, we didn't talk much
I didn't know what you were goin' through
I'm sorry that I wasn't there
To hug your mama at the funeral
Brian said he broke down
But he promised it was beautiful
When we were young
We didn't care
We shout for the stars
I see you up there
You had a heart of gold (yeah)
You had a heart of gold
You left too soon, it was out of your control
Underneath your skin and bone
You had a heart of gold
I didn't cry
I didn't even feel the pain
And then it hit me all at once
When we talked about you yesterday
When we were young (when we were young)
We didn't care (we didn't care)
We shot for the stars (we shot for the stars)
I see you up there
You had a heart of gold (oh)
You had a heart of gold
You left too soon, it was out of your control
Underneath your skin and bone
You had a heart of gold
When we were young
We didn't care
We shout for the stars
I see you up there (you had a heart of gold)
When we were young (ooh)
We didn't care (we didn't care)
We shout for the stars
I see you up there (ooh)
You had a heart of gold"
1995,O Que É Que a Gente Não Faz Por Amor?,Gian e Giovani,"Ela já chega bem cedo, me tira do sono
Faz um chamego e me diz que sou seu dono
Faz um jeitinho manhoso de quem nada quer
No fim, eu acabo seu homem
E ela minha mulher
E assim começa outra noite, paixão e ternura
Dois corpos rolando na cama, gostosa loucura
E eu nunca pensei que fosse tão bom assim
Num piscar de olhos, tomou conta de mim
E assim ela entrou de uma vez nesse peito meu
E o que é que a gente não faz por amor?
Mas o que a gente não faz por paixão?
Briga com o mundo, pisa no fundo do coração
E o que é que a gente não faz por amor?
Mas o que a gente não faz por paixão?
Fica perdido, aborrecido na solidão
E assim começa outra noite, paixão e ternura
Dois corpos rolando na cama, gostosa loucura
E eu nunca pensei que fosse tão bom assim
Num piscar de olhos, tomou conta de mim
E assim ela entrou de uma vez nesse peito meu
E o que é que a gente não faz por amor?
Mas o que a gente não faz por paixão?
Briga com o mundo, pisa no fundo do coração
E o que é que a gente não faz por amor?
Mas o que a gente não faz por paixão?
Fica perdido, aborrecido na solidão"
1971,Não Quero Dinheiro (Só Quero Amar),Tim Maia,"Vou pedir pra você voltar
Vou pedir pra você ficar
Eu te amo
Eu te quero bem
Vou pedir pra você gostar
Vou pedir pra você me amar
Eu te amo, eu te adoro
Meu amor
A semana inteira
Fiquei esperando
Pra te ver sorrindo
Pra te ver cantando
Quando a gente ama
Não pensa em dinheiro
Só se quer amar, se quer amar, se quer amar
De jeito maneira
Não quero dinheiro
Quero amor sincero
Isto é que eu espero
Grito ao mundo inteiro
Não quero dinheiro
Eu só quero amar
Te espero para ver se você vem
Não te troco nesta vida por ninguém
Porque eu te amo
Eu te quero bem
Acontece que, na vida, a gente tem
Que ser feliz por ser amado por alguém
Porque eu te amo, eu te adoro
Meu amor
A semana inteira
Fiquei esperando
Pra te ver sorrindo
Pra te ver cantando
Quando a gente ama
Não pensa em dinheiro
Só se quer amar, se quer amar, se quer amar
De jeito maneira
Não quero dinheiro
Quero amor sincero
Isto é que eu espero
Grito ao mundo inteiro
Não quero dinheiro
Eu só quero amar (só quero amar)
A semana inteira
Fiquei esperando
Pra te ver sorrindo
Pra te ver cantando
Quando a gente ama
Não pensa em dinheiro
Só se quer amar, se quer amar, se quer amar
De jeito maneira
Não quero dinheiro
Quero amor sincero
Isto é que eu espero
Grito ao mundo inteiro
Não quero dinheiro
Eu só quero amar (amar, yeah, yeah, yeah, yeah)
A semana inteira
Fiquei esperando
Pra te ver sorrindo
Pra te ver cantando
Quando a gente ama
Não pensa em dinheiro
Só se quer amar, se quer amar, se quer amar"
2007,What Goes Around.../...Comes Around,Justin Timberlake,"Hey, girl
Is he everything you wanted in a man?
You know I gave you the world
You had me in the palm of your hand
So, why your love went away?
I just can't seem to understand
Thought it was me and you, baby
Me and you until the end
But I guess I was wrong
Don't wanna think about it (uh)
Don't wanna talk about it (uh)
I'm just so sick about it
I can't believe it's ending this way
Just so confused about it (uh)
Feeling the blues about it (yeah)
I just can't do without ya
Tell me, is this fair?
Is this the way it's really going down?
Is this how we say goodbye?
Should've known better when you came around
That you were gonna make me cry
It's breaking my heart to watch you run around
'Cause I know that you're living a lie
But that's okay, baby
'Cause in time you will find
What goes around, goes around, goes around
Comes all the way back around
What goes around, goes around, goes around
Comes all the way back around
What goes around, goes around, goes around
Comes all the way back around
What goes around, goes around, goes around
Comes all the way back around
Yeah
Now, girl
I remember everything that you claimed
You said that you were moving on now (on now)
Maybe I should do the same (maybe I should do the same)
The funny thing about that is
I was ready to give you my name
Thought it was me and you, baby (baby)
And now, it's all just a shame
That I guess I was wrong
Don't wanna think about it (no)
Don't wanna talk about it (hum)
I'm just so sick about it
I can't believe it's ending this way
Just so confused about it (uh)
Feeling the blues about it (yeah)
I just can't do without ya
Can you tell me, is this fair?
Is this the way it's really going down?
Is this how we say goodbye?
Should've known better when you came around
That you were gonna make me cry
It's breaking my heart to watch you run around
'Cause I know that you're living a lie
But that's okay, baby
'Cause in time you will find
What goes around, goes around, goes around
Comes all the way back around
What goes around, goes around, goes around
Comes all the way back around
What goes around, goes around, goes around
Comes all the way back around
What goes around, goes around, goes around
Comes all the way back around
Yeah
What goes around, comes around
Yeah
What goes around, comes around
You should know that
What goes around, comes around
Yeah
What goes around, comes around
You should know that
Don't wanna think about it (no)
Don't wanna talk about it (hm)
I'm just so sick about it
I can't believe it's ending this way
Just so confused about it (uh)
Feeling the blues about it (yeah)
I just can't do without ya
Tell me is this fair
What goes around, goes around, goes around
Comes all the way back around
(What goes around, comes around, baby)
What goes around, goes around, goes around
Comes all the way back around
(What goes around, comes around, baby)
What goes around, goes around, goes around
Comes all the way back around
What goes around, goes around, goes around
Comes all the way back around
Yeah
Yup, yup
Yup
(Let me paint this picture for you, baby)
Yup
You spend your nights alone
And he never comes home
And everytime you call him
All you get's a busy tone
I heard you found out
That he's doing to you
What you did to me
Ain't that the way it goes?
When you cheated, girl
My heart bleeded, girl
So it goes without saying
That ya left me feeling hurt
Just a classic case, a scenario
Tale as old as time
Girl, you got what you deserved
And now you want somebody
To cure the lonely nights
You wish you had somebody
That could come and make it right
But girl, I ain't somebody
I'm out of sympathy
See
What goes around comes back around
I thought I told ya, hey
What goes around comes back around
I thought I told ya, hey
What goes around comes back around
I thought I told ya, hey
What goes around comes back around
I thought I told ya, hey
Take it to 'em, J
Hey
Haha
See, you shoulda listened to me, baby
Take it to 'em, J
Because, what goes around comes back around
Ooh, ooh, ooh, ooh"
1980,Into The Night,Benny Mardones,"She's just sixteen years old
Leave her alone, they say,
Separated by fools
Who don't know what love is yet
But I want you to know
If I could fly
I'd pick you up
I'd take you into the night
And show you a love
Like you've never seen - ever seen
It's like having a dream
Where nobody has a heart
It's like having it all
And watching it fall apart
And I would wait till the end
Of time for you
And do it again, it's true
I can't measure my love
There's nothing to compare it to
But I want you to know
If I could fly
I'd pick you up
I'd take you into the night
And show you a love
If I could fly
I'd pick you up
I'd take you into the night
And show you a love
Like you've never seen - ever seen
If I could fly
I'd pick you up
I'd take you into the night
And show you a love
If I could fly
I'd pick you up
I'd take you into the night..."
1975,Get Down Tonight,KC And The Sunshine Band,"Baby, baby let's get together
Honey, honey me and you
And do the things, oh, do the things
That we like to do
Oh, do a little dance, make a little love
Get down tonight, get down tonight
Do a little dance, make a little love
Get down tonight, get down tonight
Baby, babe I meet you
Same place, same time
Where we can, oh, get together
And ease up our mind
Oh, do a little dance, make a little love
Get down tonight, get down tonight
Do a little dance, make a little love
Get down tonight, get down tonight, baby
Do a little dance, make a little love
Get down tonight, get down tonight
Do a little dance, make a little love
Get down tonight, get down tonight, baby
Get down, get down, get down, get down
Get down, get down, get down, get down, get down tonight, baby
Wo, wo, wo, wo, wo, wo, wo, wo
Get down, get down, get down, get down, get down tonight, baby
Na, na, na, na, na, na, na, na
Get down, get down, get down, get down, get down tonight, baby
Wo, wo, wo, wo, wo, wo, wo, wo
Get down, get down, get down, get down, get down tonight, baby
Get down, get down, get down, get down, get down tonight, baby
Wo, wo, wo, wo, wo, wo, wo, wo
Get down, get down, get down, get down, get down tonight, baby"
1977,C'est La Vie,Emerson Lake And Palmer,"C'est la vie
Have your leaves all turned to brown
Will you scatter them around you
C'est la vie
Do you love
And then how am I to know
If you dont let your love show for me
C'est la vie
Oh c'est la vie
Oh c'est la vie
Who knows, who cares, for me
C'est la vie
In the night
Do you light a lover's fire
Do the ashes of desire for you remain
Like the sea
There's a love to deep to show
Took a storm before my love
Flowed for you
C'est la vie
Oh c'est la vie
Oh c'est la vie
Who knows, who cares, for me
C'est la vie
Like a song
Out of tune and out of time
All I needed was a rhyme for you
C'est la vie
Do you give
Do you live from day to day
Is there no song I can play for you
C'est la vie
Oh c'est la vie
Oh c'est la vie
Who knows, who cares, for me
C'est la vie"
1971,If,Bread,"If a picture paints a thousand words
Then why can't I paint you?
The words will never show the you I've come to know
If a face could launch a thousand ships
Then where am I to go?
There's no one home but you
You're all that's left me too
And when my love for life is running dry
You come and pour yourself on me
If a man could be two places at one time
I'd be with you
Tomorrow and today, beside you all the way
If the world should stop revolving spinning slowly down to die
I'd spend the end with you
And when the world was through
Then one by one the stars would all go out
Then you and I would simply fly away"
